### ISSUE TITLE
0.4.2 ↔ 0.4.1 peers report `incompatible: false` but pass no traffic

### ISSUE THREAD

**Issue by poommin2543** [rayfish/rayfish#175]
## Summary

A 0.4.2 peer and a 0.4.1 peer connect, report `incompatible: false`, negotiate `alpn=rayfish/mesh/6`, and show a healthy `Direct` path with a plausible RTT — but no traffic reaches the TUN in one direction. The QUIC connection counts the bytes arriving; the forwarder reports `rx=0`. Nothing in either log says the versions disagree.

Upgrading both ends to 0.4.2 fixed it. Upgrading only one end did not.

## Environment

| | |
|---|---|
| A | macOS 26.5 (25F71), arm64, member |
| B | Ubuntu 24.04.4 LTS, x86_64, LXC container, coordinator |
| Transport | `conn_type: Direct`, same /24 LAN, rtt ~13 ms |

## Steps to reproduce

1. Both peers on 0.4.1 (d26f7355), joined, `ray status` shows the peer up.
2. `ping6 <peer>.ray` from A.

## Actual result

100% loss in both directions, at every payload size (56 B and 1000 B alike).

B receives and replies, and drops nothing:

```
rayfish::stats: (30s) rx=5 tx=6 bytes_rx=5240 bytes_tx=5320 drops=0
```

A, same window — sends fine, receives nothing:

```
rayfish::stats: (30s) rx=0 tx=5 bytes_rx=0 bytes_tx=5240 drops=8
```

But A's QUIC connection did receive the replies. `ray status --json`, taken either side of five 1000-byte pings:

```
before: bytes_rx=20809  bytes_tx=34271  datagrams_rx=239  datagrams_tx=253
after:  bytes_rx=26776  bytes_tx=40149  datagrams_rx=258  datagrams_tx=272
```

`+5967` bytes and `+19` datagrams in, matching the five replies — while the forwarder saw `rx=0`.

`tcpdump -ni utun12` on A during the same pings shows only egress. No echo reply ever reaches the interface:

```
10:31:59.828925 IP6 <A> > <B>: ICMP6, echo request, seq 1, length 16
10:32:00.831141 IP6 <A> > <B>: ICMP6, echo request, seq 2, length 16
10:32:01.834535 IP6 <A> > <B>: ICMP6, echo request, seq 3, length 16
```

Ruled out along the way: mesh firewall on either side (set to `off` on A, symptom unchanged), host firewall on B (`ufw inactive`, nft/iptables policy `accept` throughout), routing (`200::/7 dev utun12` present, address assigned), DNS (`DNS resolved AAAA <host>.ray` works), stale daemon (`ray restart`, no change), and a third-party socket filter on A (tcpdump sits below it and saw nothing arrive).

After A alone went to 0.4.2, the symptom persisted unchanged, with:

```
daemon 0.4.2  incompat_net None  incompat_peer False  members 2
rayfish::transport: connected to peer peer=<B> alpn=rayfish/mesh/6
```

Upgrading B to 0.4.2 as well fixed it immediately — `4 packets transmitted, 4 received, 0.0% packet loss`, and TCP to port 22 connected on the first try.

## Expected result

Either the mixed pair interoperates, or the version mismatch is detected and surfaced — `ray status` flagging the peer, or a warning in the log. Silently blackholing the data plane while reporting `Direct`, a healthy RTT, and `incompatible: false` gives an operator nothing to go on.

## Notes

- Whether 0.4.1 ↔ 0.4.1 was already broken on its own is hard to separate here: that was the starting state and it did not pass traffic. The reproducible, still-present part is that a 0.4.2 ↔ 0.4.1 pair reports itself compatible and healthy while passing nothing.
- `alpn=rayfish/mesh/6` on both ends suggests the ALPN version alone is too coarse to catch whatever changed between 0.4.1 and 0.4.2.
- The 0.4.2 changelog line "mesh: Explain why QUIC datagrams need fragmentation" may be related, though the loss here is not size-dependent — 56-byte pings failed identically.

**Comment by ifdario** [comment]
there were other issues related to connections that had nothing to do with incompatibility. Please upgrade to the next stable or nightly

**Comment by ifdario** [comment]
The stall you hit was mesh connection selection, not protocol incompatibility. The fixes are on `master` after `v0.4.2`, so they land in the next stable or nightly:

- [`a24381b` Fix peer connection replacement](https://github.com/rayfish/rayfish/commit/a24381bb57aedbdd315f5e5e3f1558be973779c7): a delayed handshake from a replaced peer connection could put its stale route back into the forwarding table, leaving control ping working while ordinary mesh traffic disappeared (`rx=0`).
- [`8f3b4db` Fix simultaneous peer connection selection](https://github.com/rayfish/rayfish/commit/8f3b4db6725207393da198340b6f7ce7ce0aa0f1): every pair eagerly dials, so two healthy QUIC connections could briefly coexist and each side could end up selecting a different one.
- [`280a647` Select mesh connections by a shared TLS session ID](https://github.com/rayfish/rayfish/commit/280a64790a4afbe5f5c41c602ee71dca784298e8): both peers now pick the same live connection deterministically, by the shared TLS session ID.
- [`af4a75a` Avoid transport state swap on active packets](https://github.com/rayfish/rayfish/commit/af4a75a5d963f2fbe9edcc5165a1d452c48ad249): skip the transport state transition on each packet while the transport is already active.
- [`a52a0f6` Fix network handle announcements after stopped reconnect replies](https://github.com/rayfish/rayfish/commit/a52a0f6f5defca12d7e9202c2a35e4994e271d1e): a reconnect that sends `MeshHello` without reading the reply no longer drops the `Welcome`, so the registered peer's network handles still get announced.
- [`d067225` Test universal mesh connection selection and reconnect reuse](https://github.com/rayfish/rayfish/commit/d067225fdd0db7d2e33701a244c92dacc9dca7d0): regression tests covering the selection and reconnect reuse above.

Upgrading both ends to a build that contains these resolves the symptom. The `incompatible: false` reading was correct: the versions agreed on the wire, the connection underneath them did not stay the one carrying traffic.
